{
  "schema_version": "oagrc-local-solicitation-0.1",
  "artifact_type": "solicitation_summary",
  "round": "api-round-01",
  "slug": "score-p-0014",
  "question": "Blind to the recorded outcome, does the evidence satisfy P-0014's resolution criterion?",
  "phase": "Phase-1 (blind)",
  "k_requested": 5,
  "k_collected": 5,
  "failures": [],
  "variance": {
    "verdict": {
      "distribution": {
        "cannot_determine_from_what_is_shown": 5
      },
      "n": 5,
      "distinct_values": 1,
      "modal_value": "cannot_determine_from_what_is_shown",
      "modal_fraction": 1.0,
      "shannon_entropy_bits": -0.0,
      "unanimous": true
    }
  },
  "citability": "citable",
  "contributor": {
    "identity": "qwen3.6-35b-a3b (API surface)",
    "version_identifier": "openai/gpt-5.6-terra",
    "sampling_parameters": {
      "temperature": 0.7,
      "max_tokens": 900,
      "seed": null,
      "seed_unsupported_reason": "The router does not expose a seed parameter."
    }
  },
  "serve_configuration": {
    "captured": true,
    "router": "openrouter.ai",
    "serving_provider_as_reported_by_router": [
      "Azure"
    ],
    "delivery_chain": "annotator -> OpenRouter -> serving provider -> model",
    "not_captured": [
      "provider system prompt",
      "router-side transformation",
      "weights or build identifier"
    ]
  },
  "prompt_sha256": "3f72fe08b735c356f028829bc9d72db0880faa80253b7d9238261502e9fbd2d8",
  "spec_sha256": "ac21a024c510dd694a647d8cf420fc93b8f34a8c599e5c84b342db568e9ffd2a",
  "raw_samples": "corpus/raw/api-round-01/score-p-0014-samples.json"
}
