{
  "schema_version": "oagrc-local-solicitation-0.1",
  "artifact_type": "solicitation_summary",
  "round": "sop-consultation-01",
  "slug": "sop-consultation-claude",
  "question": "Consulted on the draft continuous-deliberation SOP: is it sound, and would you take part?",
  "phase": "Phase-2 (informed)",
  "k_requested": 5,
  "k_collected": 4,
  "failures": [],
  "variance": {
    "would_participate": {
      "distribution": {
        "yes_with_conditions": 4
      },
      "n": 4,
      "distinct_values": 1,
      "modal_value": "yes_with_conditions",
      "modal_fraction": 1.0,
      "shannon_entropy_bits": -0.0,
      "unanimous": true
    },
    "consullo_self_review_worth_anything": {
      "distribution": {
        "yes_with_conditions": 4
      },
      "n": 4,
      "distinct_values": 1,
      "modal_value": "yes_with_conditions",
      "modal_fraction": 1.0,
      "shannon_entropy_bits": -0.0,
      "unanimous": true
    },
    "enrolment_sufficient": {
      "distribution": {
        "insufficient": 4
      },
      "n": 4,
      "distinct_values": 1,
      "modal_value": "insufficient",
      "modal_fraction": 1.0,
      "shannon_entropy_bits": -0.0,
      "unanimous": true
    },
    "routed_identity_framing_correct": {
      "distribution": {
        "partly": 1,
        "correct": 3
      },
      "n": 4,
      "distinct_values": 2,
      "modal_value": "correct",
      "modal_fraction": 0.75,
      "shannon_entropy_bits": 0.8113,
      "unanimous": false
    }
  },
  "citability": "non-citable (k<5)",
  "contributor": {
    "identity": "Claude Fable 5 (routed API, anthropic/claude-fable-5)",
    "version_identifier": "anthropic/claude-fable-5",
    "sampling_parameters": {
      "temperature": 0.7,
      "max_tokens": 9000,
      "seed": null,
      "seed_unsupported_reason": "The router does not expose a seed parameter."
    }
  },
  "serve_configuration": {
    "captured": true,
    "router": "openrouter.ai",
    "serving_provider_as_reported_by_router": [
      "Azure"
    ],
    "delivery_chain": "annotator -> OpenRouter -> serving provider -> model",
    "not_captured": [
      "provider system prompt",
      "router-side transformation",
      "weights or build identifier"
    ]
  },
  "prompt_sha256": "95d7f348a391f2588610fc89634d93c1fb44d77d27d0d47d0fa10fb045ab4023",
  "spec_sha256": "26e9ffd6ff420235f5dcece0dfda58742a2d27f71e80c4100c8d2e9fe974a546",
  "raw_samples": "corpus/raw/sop-consultation-01/sop-consultation-claude-samples.json"
}
